{
  "$schema": "../../schema/component.json",
  "name": "Sheet",
  "category": "layout",
  "status": "experimental",
  "version": "0.1.0",
  "description": "Shared modal shell: a mobile bottom sheet and centered desktop dialog, with a fixed header, scrolling content, optional footer, and child-view back navigation.",
  "figma": { "nodeId": null, "componentKey": null, "notes": "Extracted from maintained PDP and search filter implementations. No standalone Figma binding is assigned yet." },
  "exports": ["Sheet", "SheetProps"],
  "composes": ["Button"],
  "variants": { "size": ["content", "full"], "contentPadding": ["default", "compact", "none"] },
  "props": {
    "open": { "type": "boolean", "required": true, "description": "Controlled visibility. Closed sheets unmount their content." },
    "title": { "type": "string", "required": true, "description": "Visible heading and accessible dialog name." },
    "closeLabel": { "type": "string", "required": true, "description": "Localized accessible label for the close action." },
    "onClose": { "type": "() => void", "required": true, "description": "Request to close; the consumer must set open to false." },
    "back": { "type": "{ label: string; onClick: () => void }", "required": false, "description": "Replaces Close with Back in a child view. Escape also goes back; the backdrop closes the whole sheet." },
    "size": { "type": "enum", "values": ["content", "full"], "default": "content", "required": false, "description": "Mobile content height starts at 50dvh and grows to the visible viewport minus its top safe area, with at least 48px reserved. Full height fills that maximum. Desktop is centered at 560px." },
    "contentPadding": { "type": "enum", "values": ["default", "compact", "none"], "default": "default", "required": false, "description": "Use compact for 8px content insets or none for lists that own their row padding." },
    "footer": { "type": "ReactNode", "required": false, "description": "Caller-owned actions outside the scrolling content, with bottom safe-area protection." },
    "children": { "type": "ReactNode", "required": true, "description": "Business content. Sheet does not own selection or draft state." }
  },
  "rules": {
    "radii": { "ruleId": "no-custom-radii", "note": "Uses the shared surface radius; bottom corners are flush on mobile." },
    "focus": { "ruleId": "focus-style", "note": "Uses Button focus rings, confines Tab navigation, and restores the opener on close." },
    "tapTarget": { "ruleId": "tap-target", "note": "Close/back controls are visually 32px with centered 20px icons and Button's 44px hit-area extender." }
  },
  "tokens": ["--surface-primary", "--text-primary", "--overlay-scrim", "--divider-default", "--radius-surface-default", "--font-size-heading-2xl", "--font-weight-emphasize", "--space-100", "--space-200", "--space-600"],
  "tokenBindings": {
    "--surface-primary": { "property": "background", "selector": ".sheet" },
    "--overlay-scrim": { "property": "background", "selector": ".sheet::backdrop" },
    "--radius-surface-default": { "property": "border-radius", "selector": ".sheet" },
    "--font-size-heading-2xl": { "property": "font-size", "selector": ".title" }
  },
  "accessibility": {
    "role": "dialog", "wcagLevel": "AA", "tapTargetMin": 44,
    "keyboardNav": ["tab", "shift+tab", "escape", "enter", "space"],
    "ariaPattern": "Native modal dialog labelled by its visible h2",
    "interaction": "showModal makes the background inert. Close restores the opener; child views focus Back and use Escape to return."
  },
  "dependencies": { "runtime": ["react"], "peer": [], "devOnly": [] },
  "usageRef": "./usage.md",
  "examples": ["./examples.tsx#SheetExample"]
}
